[
  {
    "id": "P101",
    "source_type": "official_record",
    "title": "中国人民大学新闻学院传播学硕士专业项目介绍",
    "authors_or_organization": ["中国人民大学新闻学院"],
    "year": null,
    "publisher_or_venue": "中国人民大学新闻学院",
    "doi": null,
    "url": "https://jcr.ruc.edu.cn/jxxm/ss/ss_zyjxmjs/10cfe10387b649c8a0fdd75c1a9c22b4.htm",
    "language": "zh-CN",
    "accessed_at": "2026-09-15",
    "access_status": "excerpt",
    "bibliographic_note": "学院项目介绍的搜索索引片段记载张隆栋20世纪50年代在《国际新闻界》介绍传播学，以及20世纪80年代初开设传播学课程等院系史线索。页面本轮直接打开超时，故仅登记excerpt，不用来支持页面片段以外的细节。"
  },
  {
    "id": "P102",
    "source_type": "scholarly_synthesis",
    "title": "理论谱系与本土探索：新中国传播学理论研究70年（1949—2019）",
    "authors_or_organization": ["刘涛"],
    "year": 2019,
    "publisher_or_venue": "《新闻与传播研究》2019年第10期；中国社会科学网全文转载",
    "doi": null,
    "url": "https://www.cssn.cn/xwcbx/__deleted_2022.12.31_13.46.18__xwcbx_xkqy/202208/t20220802_5440270.shtml",
    "language": "zh-CN",
    "accessed_at": "2026-09-15",
    "access_status": "full_text",
    "bibliographic_note": "本轮核读全文的理论译介、控制论传统、社会心理学传统等段落。它是学术史综合材料，可支持作者对张隆栋、邵培仁、祝建华、潘忠党等学术史位置的概括，但不能替代各学者原作。"
  },
  {
    "id": "P103",
    "source_type": "official_record",
    "title": "张国良",
    "authors_or_organization": ["上海交通大学智能传播研究院"],
    "year": 2024,
    "publisher_or_venue": "上海交通大学",
    "doi": null,
    "url": "https://ici.sjtu.edu.cn/news/show-501.html",
    "language": "zh-CN",
    "accessed_at": "2026-09-15",
    "access_status": "full_text",
    "bibliographic_note": "机构顾问页列出教育经历、历任职务、2002年发起成立中国传播学会及部分代表作。机构评价和数量性荣誉不直接转写为学术结论。"
  },
  {
    "id": "P104",
    "source_type": "official_record",
    "title": "范敬宜新闻教育奖历届资料",
    "authors_or_organization": ["清华大学新闻与传播学院"],
    "year": null,
    "publisher_or_venue": "清华大学新闻与传播学院",
    "doi": null,
    "url": "https://qxcm.tsjc.tsinghua.edu.cn/pc/folder124",
    "language": "zh-CN",
    "accessed_at": "2026-09-15",
    "access_status": "full_text",
    "bibliographic_note": "页面列有张国良、邵培仁、童兵等历届新闻教育良师奖资料入口；只用于确认奖项记录和教育者线索。"
  },
  {
    "id": "P105",
    "source_type": "scholarly_synthesis",
    "title": "中国传播学领域的先行者和开拓者——邵培仁传播学研究成果述评",
    "authors_or_organization": ["林凯"],
    "year": 2020,
    "publisher_or_venue": "《东南传播》2020年第3期；浙江传媒学院新闻传播研究院转载",
    "doi": null,
    "url": "https://rijc.cuz.edu.cn/info/1029/1521.htm",
    "language": "zh-CN",
    "accessed_at": "2026-09-15",
    "access_status": "full_text",
    "bibliographic_note": "全文按阶段梳理邵培仁的传播学教材、媒介经营管理、本土化及华夏传播研究。属于成果述评，不将文中的褒奖性评价作为独立事实。"
  },
  {
    "id": "P106",
    "source_type": "scholarly_synthesis",
    "title": "新闻学家——童兵",
    "authors_or_organization": ["涵奋"],
    "year": 1999,
    "publisher_or_venue": "《中国人民大学学报》1999年第5期",
    "doi": null,
    "url": "https://xuebao.ruc.edu.cn/CN/article/downloadArticleFile.do?attachType=PDF&id=10275",
    "language": "zh-CN",
    "accessed_at": "2026-09-15",
    "access_status": "full_text",
    "bibliographic_note": "两页人物述评，核读其关于马克思主义新闻思想与新闻传播原理研究的概括；人物评价需与具体论点分开。"
  },
  {
    "id": "P107",
    "source_type": "official_record",
    "title": "《理论新闻传播学导论》馆藏书目记录",
    "authors_or_organization": ["中国人民大学图书馆"],
    "year": 2011,
    "publisher_or_venue": "中国人民大学中文学术资源发现平台",
    "doi": null,
    "url": "https://lib.ruc.edu.cn/docs/2023-11/a90b6d224bb04407b144f04ccc4e9595.pdf",
    "language": "zh-CN",
    "accessed_at": "2026-09-15",
    "access_status": "metadata",
    "bibliographic_note": "书目记录列作者、版本、出版社、ISBN和内容摘要；只作为教材范围与版本入口，不冒充全书核读。"
  },
  {
    "id": "P108",
    "source_type": "official_record",
    "title": "陈力丹：荣休教师",
    "authors_or_organization": ["中国人民大学新闻学院"],
    "year": null,
    "publisher_or_venue": "中国人民大学新闻学院",
    "doi": null,
    "url": "https://jcr.ruc.edu.cn/zw/jzyg/rxjs/df55c95316b14224ada5ed31bd94e458.htm",
    "language": "zh-CN",
    "accessed_at": "2026-09-15",
    "access_status": "full_text",
    "bibliographic_note": "学院荣休教师页列出研究方向、教育背景和《精神交往论》等代表作。当前职务表述按访问日记录，不外推未来状态。"
  },
  {
    "id": "P109",
    "source_type": "official_record",
    "title": "单波：师资力量",
    "authors_or_organization": ["武汉大学新闻与传播学院"],
    "year": null,
    "publisher_or_venue": "武汉大学新闻与传播学院",
    "doi": null,
    "url": "https://journal.whu.edu.cn/intro/faculty/shanb",
    "language": "zh-CN",
    "accessed_at": "2026-09-15",
    "access_status": "full_text",
    "bibliographic_note": "学院教师页列出比较新闻学、跨文化传播研究方向及《跨文化传播的问题与可能性》等成果；历史兼职保留页面所示时间范围。"
  },
  {
    "id": "P110",
    "source_type": "primary_scholarship",
    "title": "跨文化传播的问题域",
    "authors_or_organization": ["单波"],
    "year": 2020,
    "publisher_or_venue": "武汉大学新闻传播评论",
    "doi": null,
    "url": "https://xwcbpl.whu.edu.cn/xljy/2020-10-02/142.html",
    "language": "zh-CN",
    "accessed_at": "2026-09-15",
    "access_status": "full_text",
    "bibliographic_note": "用于呈现作者如何以问题域组织跨文化传播研究；不由单篇文本概括其全部学术贡献。"
  },
  {
    "id": "P111",
    "source_type": "official_record",
    "title": "Zhongdang Pan",
    "authors_or_organization": ["University of Wisconsin–Madison Department of Communication Arts"],
    "year": null,
    "publisher_or_venue": "University of Wisconsin–Madison",
    "doi": null,
    "url": "https://commarts.wisc.edu/staff/pan-zhongdang/",
    "language": "en",
    "accessed_at": "2026-09-15",
    "access_status": "full_text",
    "bibliographic_note": "院系教师页列出教育经历、传播科学方向、框架、公共讨论、媒介效果及中国传媒研究等主题。动态研究项目按访问日理解。"
  },
  {
    "id": "P112",
    "source_type": "primary_scholarship",
    "title": "Framing Analysis: An Approach to News Discourse",
    "authors_or_organization": ["Zhongdang Pan", "Gerald M. Kosicki"],
    "year": 1993,
    "publisher_or_venue": "Political Communication, 10(1), 55–75",
    "doi": "10.1080/10584609.1993.9962963",
    "url": "https://doi.org/10.1080/10584609.1993.9962963",
    "language": "en",
    "accessed_at": "2026-09-15",
    "access_status": "abstract",
    "bibliographic_note": "本轮核到期刊书目与摘要；只支持其把新闻话语分析置于来源、记者、受众和共享文化参与的社会认知过程之中，不声称已核全文全部分析维度。"
  },
  {
    "id": "P113",
    "source_type": "official_record",
    "title": "Jian Hua Jonathan Zhu",
    "authors_or_organization": ["City University of Hong Kong"],
    "year": null,
    "publisher_or_venue": "CityUHK Scholars",
    "doi": null,
    "url": "https://scholars.cityu.edu.hk/en/persons/enjhzhu/",
    "language": "en",
    "accessed_at": "2026-09-15",
    "access_status": "full_text",
    "bibliographic_note": "机构学者档案列出计算传播、纵向研究、新媒体理论和定量方法等教学研究线索及成果目录。动态成果按访问日记录。"
  },
  {
    "id": "P114",
    "source_type": "official_record",
    "title": "刘海龙",
    "authors_or_organization": ["中国人民大学新闻学院"],
    "year": null,
    "publisher_or_venue": "中国人民大学新闻学院",
    "doi": null,
    "url": "https://jcr.ruc.edu.cn/jszy/899fd1e5eb5e4de2aee3cd9fb8c1fc0d.htm",
    "language": "zh-CN",
    "accessed_at": "2026-09-15",
    "access_status": "full_text",
    "bibliographic_note": "教师页列出传播思想史、政治传播、传媒文化等研究方向、课程与代表作。职务按访问日记录，评价性内容不直接采用。"
  },
  {
    "id": "P115",
    "source_type": "official_record",
    "title": "传播学专业介绍",
    "authors_or_organization": ["刘海龙", "中国人民大学新闻学院"],
    "year": null,
    "publisher_or_venue": "中国人民大学新闻学院",
    "doi": null,
    "url": "https://jcr.ruc.edu.cn/jxxm/bk/bk_zyjs/b3523107112943929e0f4715a1d21bba.htm",
    "language": "zh-CN",
    "accessed_at": "2026-09-15",
    "access_status": "full_text",
    "bibliographic_note": "学院本科专业介绍由刘海龙署名，用于理解其如何面向学生解释传播学问题与专业视野；属于教学说明，不替代学术原作。"
  }
]
