[
  {
    "id": "Q341",
    "source_type": "primary_scholarship",
    "title": "The Two-Step Flow of Communication: An Up-To-Date Report on an Hypothesis",
    "authors_or_organization": ["Elihu Katz"],
    "year": 1957,
    "publisher_or_venue": "Public Opinion Quarterly, 21(1), 61–78",
    "doi": "10.1086/266687",
    "url": "https://repository.upenn.edu/server/api/core/bitstreams/0071f2b9-cd77-4bd3-a5ce-8a2a29ea1d4e/content",
    "language": "en",
    "accessed_at": "2026-09-15",
    "access_status": "full_text",
    "bibliographic_note": "已直接下载并逐页提取宾夕法尼亚大学 ScholarlyCommons 托管的 11 页开放 PDF。PDF 第 1 页的摘要与开篇给出假说、连续研究及其对调查设计中人际关系的处理；第 3 页明确区分个人影响、个人影响流动、意见领袖与媒体三项；第 10 页概括后续研究的精炼。该来源支持经典研究及其历史证据范围，不支持对当代平台网络的实时外推。"
  }
]
