[
  {
    "id": "Q343",
    "source_type": "scholarly_synthesis",
    "title": "Issues and Best Practices in Content Analysis",
    "authors_or_organization": [
      "Stephen Lacy",
      "Brendan R. Watson",
      "Daniel Riffe",
      "Jennette Lovejoy"
    ],
    "year": 2015,
    "publisher_or_venue": "Journalism & Mass Communication Quarterly, 92(4), pp. 791–811",
    "doi": "10.1177/1077699015607338",
    "url": "https://www.researchgate.net/publication/282307144_Issues_and_Best_Practices_in_Content_Analysis",
    "language": "en",
    "accessed_at": "2026-09-15",
    "access_status": "full_text",
    "bibliographic_note": "ResearchGate 页面标示 Public Full-text，且全文由合著者 Jennette Lovejoy 于 2016-05-23 上传；本轮在页面实际核读 pp. 1、10–12、13–18。用于内容分析的报告、抽样、人工编码一致性与自动文本分析的验证／可复现建议。文章明确是作者团队提出的 best practices，且承认部分标准仍在争论中；不把它当作全领域统一流程或实时平台证据。页面提示内容可能受版权保护；项目仅登记书目信息、可定位范围与自行概述。"
  }
]
