[
  {
    "id": "Q301",
    "source_type": "primary_scholarship",
    "title": "Organizing and the Process of Sensemaking",
    "authors_or_organization": ["Karl E. Weick", "Kathleen M. Sutcliffe", "David Obstfeld"],
    "year": 2005,
    "publisher_or_venue": "Organization Science, 16(4), 409–421",
    "doi": "10.1287/orsc.1050.0133",
    "url": "https://pubsonline.informs.org/doi/abs/10.1287/orsc.1050.0133",
    "language": "en",
    "accessed_at": "2026-09-15",
    "access_status": "abstract",
    "bibliographic_note": "已打开 INFORMS 文章页并核对摘要。摘要将 sensemaking 说明为把情境转化为可用语言明确理解、并可导向行动的情境；同时指出意义在其中形成并影响身份与行动。未将摘要外的八项属性当作已核实结论。"
  },
  {
    "id": "Q302",
    "source_type": "primary_scholarship",
    "title": "Parasocial Interaction and Parasocial Relationship: Conceptual Clarification and a Critical Assessment of Measures",
    "authors_or_organization": ["Jayson L. Dibble", "Tilo Hartmann", "Sarah F. Rosaen"],
    "year": 2016,
    "publisher_or_venue": "Human Communication Research, 42(1), 21–44",
    "doi": "10.1111/hcre.12063",
    "url": "https://academic.oup.com/hcr/article-abstract/42/1/21/4067693",
    "language": "en",
    "accessed_at": "2026-09-15",
    "access_status": "abstract",
    "bibliographic_note": "已打开 Oxford Academic 页面并核对摘要。研究指出 PSI 与 PSR 常被概念和方法混用；在 N=383 的视频实验中，EPSI 量表较 PSI-Scale 更能测量被界定为观看期间相互觉知的 PSI。"
  },
  {
    "id": "Q303",
    "source_type": "scholarly_synthesis",
    "title": "The Attention Economy and the Net",
    "authors_or_organization": ["Michael H. Goldhaber"],
    "year": 1997,
    "publisher_or_venue": "First Monday, 2(4)",
    "doi": "10.5210/fm.v2i4.519",
    "url": "https://firstmonday.org/ojs/index.php/fm/article/download/519/440?inline=1",
    "language": "en",
    "accessed_at": "2026-09-15",
    "access_status": "full_text",
    "bibliographic_note": "已打开全文并核对“New Natural Economy”与“Wealth and Property Take New Forms, Too”部分。作者将网络信息的丰裕与注意的内在稀缺相对照，并将“获得注意”作为其理论框架中的持久财富/财产；这是作者的概念性论证，不是当代平台指标的经验验证。"
  },
  {
    "id": "Q304",
    "source_type": "primary_scholarship",
    "title": "Groupthink",
    "authors_or_organization": ["Irving L. Janis"],
    "year": 1971,
    "publisher_or_venue": "Psychology Today, November 1971; later developed in Victims of Groupthink (1972)",
    "doi": null,
    "url": "https://web.mit.edu/curhan/www/docs/Articles/15341_Readings/Group_Dynamics/Janis_Groupthink.pdf",
    "language": "en",
    "accessed_at": "2026-09-15",
    "access_status": "full_text",
    "bibliographic_note": "已打开 MIT 托管的 8 页原始文章 PDF 并核对其开篇论述。Janis 将案例中的问题归于他称为 groupthink 的现象，并将其与凝聚群体中对异议和替代方案的社会压力联系起来。该 PDF 是原始期刊文重印，页面未提供完整卷期页码，故不补写未经核实的卷期。"
  },
  {
    "id": "Q305",
    "source_type": "scholarly_synthesis",
    "title": "Beyond Fiasco: A Reappraisal of the Groupthink Phenomenon and a New Model of Group Decision Processes",
    "authors_or_organization": ["Ramon J. Aldag", "Sally Riggs Fuller"],
    "year": 1993,
    "publisher_or_venue": "Psychological Bulletin, 113(3), 533–552",
    "doi": "10.1037/0033-2909.113.3.533",
    "url": "https://web.mit.edu/writing/2012/Grad_Summary_Readings/beyond_fiasco_final.pdf",
    "language": "en",
    "accessed_at": "2026-09-15",
    "access_status": "full_text",
    "bibliographic_note": "已打开 20 页全文 PDF 并核对第 534 页的论证。作者认为 Janis 模型建立于较小且受限的样本、被广泛泛化，并未获得一致的经验支持；同时承认它对群体问题解决研究具有启发价值。"
  },
  {
    "id": "Q306",
    "source_type": "scholarly_synthesis",
    "title": "Feeling Validated Versus Being Correct: A Meta-Analysis of Selective Exposure to Information",
    "authors_or_organization": ["William Hart", "Dolores Albarracín", "Alice H. Eagly", "Inge Brechan", "Matthew J. Lindberg", "Lisa Merrill"],
    "year": 2009,
    "publisher_or_venue": "Psychological Bulletin, 135(4), 555–588",
    "doi": "10.1037/a0015701",
    "url": "https://pmc.ncbi.nlm.nih.gov/articles/PMC4797953/",
    "language": "en",
    "accessed_at": "2026-09-15",
    "access_status": "abstract",
    "bibliographic_note": "已核对 PMC 返回的论文摘要；直接打开时页面返回访问验证，故不把正文定位标作已访问。摘要报告对态度一致信息的中等偏好（d = 0.36），并指出防御与准确性动机会调节该偏好；与当前目标相关时可出现对不一致信息的偏好。"
  },
  {
    "id": "Q307",
    "source_type": "scholarly_synthesis",
    "title": "The Selective Exposure Self- and Affect-Management (SESAM) Model: Applications in the Realms of Race, Politics, and Health",
    "authors_or_organization": ["Silvia Knobloch-Westerwick"],
    "year": 2015,
    "publisher_or_venue": "Communication Research, 42(7), 959–985",
    "doi": "10.1177/0093650214539173",
    "url": "https://journals.sagepub.com/doi/10.1177/0093650214539173",
    "language": "en",
    "accessed_at": "2026-09-15",
    "access_status": "abstract",
    "bibliographic_note": "已打开 SAGE 页面并核对摘要。文章把选择性接触的理论和方法讨论组织为 self、affect、motivations、time 等要素，并以种族、政治与健康讯息说明应用；摘要不支持对任一具体平台的效果断言。"
  }
]
