[
  {
    "id": "Q348",
    "source_type": "primary_scholarship",
    "title": "Social Cognitive Theory of Mass Communication",
    "authors_or_organization": [
      "Albert Bandura"
    ],
    "year": 2001,
    "publisher_or_venue": "Media Effects: Advances in Theory and Research (2nd ed.), pp. 121–153, chapter manuscript",
    "doi": null,
    "url": "https://techofcomm.wordpress.com/wp-content/uploads/2015/09/bandura-sct-of-mass-communication.pdf",
    "language": "en",
    "accessed_at": "2026-09-16",
    "access_status": "full_text",
    "bibliographic_note": "已直接打开并核读 28 页全文手稿。首页署名 Albert Bandura、Stanford University，并自载 Bandura（2001）收录于 Media Effects: Advances in Theory and Research 第2版、pp. 121–153 的书目信息；题名、作者及核心文本与出版社所载同题 Media Psychology 论文摘要和 CiteSeerX 机构索引文本相符。已核读 PDF pp. 2–20 的理论框架、观察学习机制、媒介与人际来源、双路径及社会扩散章节。当前可读副本由第三方教学站点托管，不是作者或出版社库；因此来源支持正文内容与页码定位，但不据此声称该站点具有正式出版者身份，也不将理论性综合当作特定媒介效果的独立实证检验。"
  }
]
