[
  {"id":"P201","source_type":"official_record","title":"Public Opinion, by Walter Lippmann","authors_or_organization":["University of Pennsylvania Libraries"],"year":1922,"publisher_or_venue":"The Online Books Page","doi":null,"url":"https://onlinebooks.library.upenn.edu/webbin/book/lookupid?key=olbp70373","language":"en","accessed_at":"2026-09-15","access_status":"metadata","bibliographic_note":"大学图书馆书目记录作者、1922年初版信息与主题；作为原作入口，不声称已在本站核读全书。"},
  {"id":"P202","source_type":"official_record","title":"Public Opinion","authors_or_organization":["Walter Lippmann","Simon & Schuster / Free Press"],"year":1997,"publisher_or_venue":"Free Press","doi":null,"url":"https://www.simonandschuster.com/books/Public-Opinion/Walter-Lippmann/9780684833279","language":"en","accessed_at":"2026-09-15","access_status":"excerpt","bibliographic_note":"出版社页面提供作者说明、内容简介与版本信息；用于确认该书在公众舆论、信息与传播问题中的定位。"},
  {"id":"P203","source_type":"official_record","title":"Schramm, Wilbur Lang","authors_or_organization":["University of Iowa Press","University of Iowa Libraries"],"year":null,"publisher_or_venue":"The Biographical Dictionary of Iowa","doi":null,"url":"https://uipress.lib.uiowa.edu/bdi/DetailsPage.aspx?id=331","language":"en","accessed_at":"2026-09-15","access_status":"full_text","bibliographic_note":"大学出版社人物词典记录其教育经历、伊利诺伊和斯坦福传播研究机构工作及学科建设。"},
  {"id":"P204","source_type":"official_record","title":"Kurt Lewin Award","authors_or_organization":["American Psychological Association","Society for the Psychological Study of Social Issues"],"year":null,"publisher_or_venue":"American Psychological Association","doi":null,"url":"https://www.apa.org/about/awards/div-9-lewin","language":"en","accessed_at":"2026-09-15","access_status":"full_text","bibliographic_note":"APA页面把Lewin记为群体动力科学先驱和SPSSI创建者；仅用于学术角色范围。"},
  {"id":"P205","source_type":"official_record","title":"Guide to the Carl Iver Hovland Papers","authors_or_organization":["Yale University Library"],"year":2025,"publisher_or_venue":"Yale University Library Manuscripts and Archives","doi":null,"url":"https://ead-pdfs.library.yale.edu/3652.pdf","language":"en","accessed_at":"2026-09-15","access_status":"full_text","bibliographic_note":"档案指南含人物小传、耶鲁传播研究项目、二战训练影片研究及说服与态度改变材料范围。"},
  {"id":"P206","source_type":"official_record","title":"Communication and Persuasion: Psychological Studies of Opinion Change","authors_or_organization":["Carl I. Hovland","Irving L. Janis","Harold H. Kelley"],"year":1953,"publisher_or_venue":"Yale University Press; U.S. Government document repository copy","doi":null,"url":"https://www.govinfo.gov/content/pkg/GOVPUB-D305-PURL-LPS83014/pdf/GOVPUB-D305-PURL-LPS83014.pdf","language":"en","accessed_at":"2026-09-15","access_status":"metadata","bibliographic_note":"政府文献库文件确认作者、书名、出版社与年份；本轮不将其登记为全书核读。"},
  {"id":"P207","source_type":"official_record","title":"Robert King Merton","authors_or_organization":["Columbia University"],"year":null,"publisher_or_venue":"Columbia University","doi":null,"url":"https://www.c250.columbia.edu/c250_celebrates/remarkable_columbians/robert_king_merton.html","language":"en","accessed_at":"2026-09-15","access_status":"full_text","bibliographic_note":"校方人物页记录其大众传播、焦点小组、与Lazarsfeld合作及应用社会研究局经历。"},
  {"id":"P208","source_type":"scholarly_synthesis","title":"Robert K. Merton","authors_or_organization":["Oxford Bibliographies in Communication"],"year":2016,"publisher_or_venue":"Oxford University Press","doi":null,"url":"https://academic.oup.com/reference/62347/reference-article-abstract/554220993?login=false","language":"en","accessed_at":"2026-09-15","access_status":"abstract","bibliographic_note":"学术工具书摘要说明Merton与Lazarsfeld合作及其对理论引导、方法严谨的经验传播研究的影响。"},
  {"id":"P209","source_type":"official_record","title":"John Dewey Bio","authors_or_organization":["University of Michigan Department of Philosophy"],"year":null,"publisher_or_venue":"University of Michigan","doi":null,"url":"https://prod.lsa.umich.edu/philosophy/graduates/opportunities/prizes/dewey/john-dewey-bio.html","language":"en","accessed_at":"2026-09-15","access_status":"full_text","bibliographic_note":"校方人物页记录其教育、实用主义、民主与公共知识取向。"},
  {"id":"P210","source_type":"teaching_resource","title":"Communication and Participation","authors_or_organization":["University of Cologne Dewey Center"],"year":null,"publisher_or_venue":"University of Cologne","doi":null,"url":"https://www.hf.uni-koeln.de/31679","language":"en","accessed_at":"2026-09-15","access_status":"full_text","bibliographic_note":"大学Dewey中心按标准版本定位其传播、共同体、参与和民主论述；属于教学性整理。"},
  {"id":"P211","source_type":"official_record","title":"Robert E. Park (1864–1944): Sociology","authors_or_organization":["University of Chicago Library"],"year":null,"publisher_or_venue":"University of Chicago Centennial Catalogues","doi":null,"url":"https://www.lib.uchicago.edu/collex/exhibits/university-chicago-centennial-catalogues/university-chicago-faculty-centennial-view/robert-e-park-1864-1944-sociology/","language":"en","accessed_at":"2026-09-15","access_status":"full_text","bibliographic_note":"大学图书馆展览页记录其新闻记者经历、公共舆论设想、芝加哥学派、城市与集体行为研究。"},
  {"id":"P212","source_type":"official_record","title":"The City","authors_or_organization":["Robert E. Park","Ernest W. Burgess","University of Chicago Press"],"year":1925,"publisher_or_venue":"University of Chicago Press","doi":null,"url":"https://press.uchicago.edu/ucp/books/book/chicago/C/bo38823801.html","language":"en","accessed_at":"2026-09-15","access_status":"excerpt","bibliographic_note":"出版社页确认原作、作者与城市民族志／社会理论定位；不替代全书阅读。"},
  {"id":"P213","source_type":"scholarly_synthesis","title":"Erving Goffman","authors_or_organization":["Oxford Bibliographies in Sociology"],"year":2019,"publisher_or_venue":"Oxford University Press","doi":null,"url":"https://academic.oup.com/reference/62417/reference-article-abstract/561735799","language":"en","accessed_at":"2026-09-15","access_status":"abstract","bibliographic_note":"学术工具书摘要定位互动秩序、自我呈现、面子工作与其学术生涯。"},
  {"id":"P214","source_type":"primary_scholarship","title":"The Interaction Order","authors_or_organization":["Erving Goffman"],"year":1983,"publisher_or_venue":"American Sociological Review, 48(1), 1–17; CSUN hosted copy","doi":null,"url":"https://www.csun.edu/~snk1966/Erving%20Goffman%20The%20Interaction%20Order.pdf","language":"en","accessed_at":"2026-09-15","access_status":"full_text","bibliographic_note":"可访问的ASA主席演讲全文，用于理解共在互动构成的分析领域。"},
  {"id":"P215","source_type":"official_record","title":"Biography and publications: Roland Barthes","authors_or_organization":["Collège de France"],"year":null,"publisher_or_venue":"Collège de France","doi":null,"url":"https://www.college-de-france.fr/en/chair/roland-barthes-literary-semiology-statutory-chair/biography","language":"en","accessed_at":"2026-09-15","access_status":"full_text","bibliographic_note":"法兰西公学院人物与著作页，用于确认其文学符号学教席、学术经历与作品范围。"},
  {"id":"P216","source_type":"official_record","title":"Biographie et publications: Michel Foucault","authors_or_organization":["Collège de France"],"year":null,"publisher_or_venue":"Collège de France","doi":null,"url":"https://www.college-de-france.fr/fr/chaire/michel-foucault-histoire-des-systemes-de-pensee-chaire-statutaire/biography","language":"fr","accessed_at":"2026-09-15","access_status":"full_text","bibliographic_note":"法兰西公学院人物页记录其思想体系史教席及话语、纪律、权力和治理研究脉络。"},
  {"id":"P217","source_type":"official_record","title":"Michel Foucault: History of systems of thought","authors_or_organization":["Collège de France"],"year":null,"publisher_or_venue":"Collège de France","doi":null,"url":"https://www.college-de-france.fr/en/chair/michel-foucault-history-of-systems-of-thought-statutory-chair","language":"en","accessed_at":"2026-09-15","access_status":"full_text","bibliographic_note":"英文教席页概括《话语的秩序》对话语控制、权力、知识与抵抗的研究。"},
  {"id":"P218","source_type":"official_record","title":"About Raymond Williams","authors_or_organization":["Swansea University"],"year":null,"publisher_or_venue":"Swansea University Centre for Research into the English Literature and Language of Wales","doi":null,"url":"https://www.swansea.ac.uk/culture-communication/research/crew/raymond-williams/about-raymond-williams/","language":"en","accessed_at":"2026-09-15","access_status":"full_text","bibliographic_note":"大学研究中心人物页记录其成人教育、《文化与社会》、情感结构及文化唯物主义相关工作。"},
  {"id":"P219","source_type":"official_record","title":"Dallas Smythe Memorial Lecture","authors_or_organization":["Simon Fraser University School of Communication"],"year":2024,"publisher_or_venue":"Simon Fraser University","doi":null,"url":"https://www.sfu.ca/davidlamcentre/news-events/past-events/2024/2024-Dallas-Smythe-Memorial-Lecture.html","language":"en","accessed_at":"2026-09-15","access_status":"full_text","bibliographic_note":"校方页面说明纪念讲座自1993年起致敬传播政治经济学批判学者，并记载Smythe在SFU任教。"},
  {"id":"P220","source_type":"scholarly_synthesis","title":"Blindspots and Blurred Lines: Dallas Smythe, the Audience Commodity, and the Transformation of Labor in the Digital Age","authors_or_organization":["Brian Dolber"],"year":2016,"publisher_or_venue":"Sociology Compass","doi":"10.1111/soc4.12387","url":"https://doi.org/10.1111/soc4.12387","language":"en","accessed_at":"2026-09-15","access_status":"abstract","bibliographic_note":"摘要把受众商品概念定位为传播政治经济学的重要起点，并说明其在数字劳动研究中的延展和争议。"},
  {"id":"P221","source_type":"official_record","title":"UCSD Communication: The Story of LCHC","authors_or_organization":["University of California San Diego"],"year":null,"publisher_or_venue":"UC San Diego","doi":null,"url":"https://lchcautobio.ucsd.edu/ucsd-communication/","language":"en","accessed_at":"2026-09-15","access_status":"full_text","bibliographic_note":"校史材料把Herbert Schiller列为推动UCSD传播学从项目发展为正式系科的重要学者之一。"}
]
