[
  {
    "id": "Q350",
    "source_type": "primary_scholarship",
    "title": "The Elaboration Likelihood Model of Persuasion",
    "authors_or_organization": [
      "Richard E. Petty",
      "John T. Cacioppo"
    ],
    "year": 1986,
    "publisher_or_venue": "Advances in Experimental Social Psychology, 19, 123–205",
    "doi": "10.1016/S0065-2601(08)60214-2",
    "url": "https://www.researchgate.net/publication/229068356_The_Elaboration_Likelihood_Model_of_Persuasion",
    "language": "en",
    "accessed_at": "2026-09-16",
    "access_status": "full_text",
    "bibliographic_note": "ResearchGate 页面提供由 Richard E. Petty 本人上传的完整章节正文，并标示为 Author content；题名、作者、卷册、页码与 DOI 均和出版社记录一致。已实际核读印刷页 125–129 的两条路径与精细加工连续体、132–136 的论据／线索及变量影响加工方式、183 和 186–191 的变量多重作用与总结。正文把中央和外周路径界定为精细加工连续体的两个锚点，取决于受众动机、能力和当时的加工过程；同一来源、信息、受众或情境变量可在不同条件下作为简单线索、改变论据审视程度或进入论据评价，不能把路径误写为两类固定信息、固定媒介内容或固定人群。"
  }
]
