[
  {
    "id": "Q345",
    "source_type": "scholarly_synthesis",
    "title": "Feeling Validated Versus Being Correct: A Meta-Analysis of Selective Exposure to Information",
    "authors_or_organization": [
      "William Hart",
      "Dolores Albarracín",
      "Alice H. Eagly",
      "Inge Brechan",
      "Matthew J. Lindberg",
      "Lisa Merrill"
    ],
    "year": 2009,
    "publisher_or_venue": "Psychological Bulletin, 135(4), 555–588",
    "doi": "10.1037/a0015701",
    "url": "https://socialactionlab.org/wp-content/uploads/2024/01/Hart_Feeling-Validated-Versus-Being-Correct-A-Meta-Analysis-of-Selective-Exposure-to-Information_2009.pdf",
    "language": "en",
    "accessed_at": "2026-09-16",
    "access_status": "full_text",
    "bibliographic_note": "已直接打开并核读作者 Dolores Albarracín 的 Social Action Lab 出版物页所链接的 34 页全文 PDF；题名、作者、期刊卷期页码与 DOI 均与发表记录一致。已核读 PDF pp. 1–7、21–29 的研究范围、方法、总体效应、调节分析、讨论与限制。全文支持总体一致信息偏好及信息相对效用较高时可能出现反向偏好；不支持把选择性接触视为人人恒定的特质，也不能用元分析中的跨研究相关性调节结果证明所有情境中的个体因果效应。"
  }
]
