[
  {
    "id": "Q342",
    "source_type": "primary_scholarship",
    "title": "Modelling Contemporary Gatekeeping: The Rise of Individuals, Algorithms and Platforms in Digital News Dissemination",
    "authors_or_organization": [
      "Wallace, Julian"
    ],
    "year": 2018,
    "publisher_or_venue": "Digital Journalism, 6(3), 274–293",
    "doi": "10.1080/21670811.2017.1343648",
    "url": "https://mediachange.ch/media/pdf/publications/Wallace2017_Digital_Gatekeeping.pdf",
    "language": "en",
    "accessed_at": "2026-09-15",
    "access_status": "full_text",
    "bibliographic_note": "University of Zurich Media Change & Innovation 站点提供的作者 postprint，共 20 页；正文与 DOI、作者、题名及期刊版本相符。已核读 PDF pp. 1–15 的引言、数字把关者类型、平台机制、模型与结论。论文提出理论模型并明确仍需后续实证检验，不能用来证明特定平台的现实效果或规范正当性。"
  }
]
