[
  {
    "id": "R421",
    "source_type": "official_record",
    "title": "Native Iowan Returns to State to Discuss Technology Diffusion and the ICN",
    "authors_or_organization": [
      "Iowa State University News Service"
    ],
    "year": 1997,
    "publisher_or_venue": "Iowa State University",
    "doi": null,
    "url": "https://archive.news.iastate.edu/oldreleases/97/IDLA.html",
    "language": "en",
    "accessed_at": "2026-09-16",
    "access_status": "full_text",
    "bibliographic_note": "爱荷华州立大学新闻档案直接记载Rogers在该校获得农业学B.S.及社会学硕士、博士学位；页面未列后两个学位的正式英文缩写和年份。"
  },
  {
    "id": "R422",
    "source_type": "official_record",
    "title": "Wilbur Schramm (2)",
    "authors_or_organization": [
      "University of Illinois Archives",
      "University of Illinois at Urbana-Champaign Photographic Services"
    ],
    "year": 1947,
    "publisher_or_venue": "University of Illinois Archives",
    "doi": null,
    "url": "https://archon.library.illinois.edu/archives/?id=4226&p=digitallibrary/digitalcontent",
    "language": "en",
    "accessed_at": "2026-09-16",
    "access_status": "full_text",
    "bibliographic_note": "档案页确认这是1947年的Wilbur Schramm肖像，并明确声明图像版权由University of Illinois持有，高清副本需联系购买；未获网站展示许可，仅列为候选，不接入portrait。"
  },
  {
    "id": "R423",
    "source_type": "official_record",
    "title": "75. Todestag von Kurt Lewin",
    "authors_or_organization": [
      "Universitätsarchiv der Humboldt-Universität zu Berlin"
    ],
    "year": 2023,
    "publisher_or_venue": "Universitätsbibliothek der Humboldt-Universität zu Berlin",
    "doi": null,
    "url": "https://www.ub.hu-berlin.de/de/standorte/archiv/gedaechtnis-der-universitaet/75-todestag-von-kurt-lewin",
    "language": "de",
    "accessed_at": "2026-09-16",
    "access_status": "full_text",
    "bibliographic_note": "柏林洪堡大学档案馆依学籍与学位档案记载Lewin于1910年由慕尼黑转入当时的柏林腓特烈·威廉大学，1916年晋升博士，1921年取得大学授课资格。"
  },
  {
    "id": "R424",
    "source_type": "other_material",
    "title": "Sculpture of Kurt Lewin, 2011",
    "authors_or_organization": [
      "Pko",
      "Wikimedia Commons"
    ],
    "year": 2011,
    "publisher_or_venue": "Wikimedia Commons",
    "doi": null,
    "url": "https://commons.wikimedia.org/wiki/File:Sculpture_of_Kurt_Lewin,_2011.jpg",
    "language": "en",
    "accessed_at": "2026-09-16",
    "access_status": "full_text",
    "bibliographic_note": "文件页标明摄影者为Pko，内容是莫吉尔诺纪念牌上的Kurt Lewin肖像雕塑，以CC BY-SA 4.0发布；可公开展示，需保留署名、许可链接和修改说明。"
  },
  {
    "id": "R425",
    "source_type": "official_record",
    "title": "Professor Erving Goffman",
    "authors_or_organization": [
      "University College, University of Toronto"
    ],
    "year": null,
    "publisher_or_venue": "University of Toronto",
    "doi": null,
    "url": "https://www.uc.utoronto.ca/alumni-influence/professor-erving-goffman",
    "language": "en",
    "accessed_at": "2026-09-16",
    "access_status": "full_text",
    "bibliographic_note": "多伦多大学University College校友页记载Goffman于1945年获B.A.，本科学习社会学与人类学，随后赴芝加哥大学完成博士学位。页面配肖像但页脚是站点All rights reserved，没有单独图像授权，不接入portrait。"
  },
  {
    "id": "R426",
    "source_type": "official_record",
    "title": "Who’s the deviant here?",
    "authors_or_organization": [
      "Carrie Golus",
      "The University of Chicago Magazine"
    ],
    "year": 2015,
    "publisher_or_venue": "University of Chicago",
    "doi": null,
    "url": "https://mag.uchicago.edu/law-policy-society/whos-deviant-here",
    "language": "en",
    "accessed_at": "2026-09-16",
    "access_status": "full_text",
    "bibliographic_note": "芝加哥大学校刊在讨论芝加哥社会学系研究生群体时，以校友学位缩写标明Goffman的A.M.为1949年、Ph.D.为1953年。"
  },
  {
    "id": "R427",
    "source_type": "other_material",
    "title": "Erving Goffman circa 1940",
    "authors_or_organization": [
      "Unknown photographer",
      "Wikimedia Commons"
    ],
    "year": 1940,
    "publisher_or_venue": "Wikimedia Commons",
    "doi": null,
    "url": "https://commons.wikimedia.org/wiki/File:Erving_Goffman_circa_1940.jpg",
    "language": "en",
    "accessed_at": "2026-09-16",
    "access_status": "full_text",
    "bibliographic_note": "文件页称其为Goffman约1940年在温尼伯中学时的照片，但作者未知，只标记为加拿大公共领域；页面警告尚需补充美国公版标签，且在部分其他法域可能仍受保护，因此仅列候选、不接入portrait。"
  }
]
