[
  {
    "id": "Q349",
    "source_type": "primary_scholarship",
    "title": "The Third-Person Effect in Communication",
    "authors_or_organization": ["W. Phillips Davison"],
    "year": 1983,
    "publisher_or_venue": "Public Opinion Quarterly, 47(1), 1–15",
    "doi": "10.1086/268763",
    "url": "https://www.romolocapuano.com/wp-content/uploads/2013/07/Davison-Third-Person-Effect.pdf",
    "language": "en",
    "accessed_at": "2026-09-16",
    "access_status": "full_text",
    "bibliographic_note": "已直接下载并核读可访问的原刊版扫描 PDF（16 个 PDF 页面，含 1 页 JSTOR 封面；原刊正文 pp. 1–15；SHA-256: c6c400fc9edaa9474ae328f4427d8aee2e95a376f2cd94bf7a5e6253db614a38）。题名、作者、卷期页码和 DOI 与 Oxford Academic 记录一致。原刊 p. 3 分别提出感知差距与可能的行动后果；pp. 4–7 报告检验自他影响估计的非正式小样本实验；pp. 9–10、13–14 提供投票、捐款、市场行动与审查的行为例证或推测。正文明确称实验规模小且条件非正式，行为案例亦多需额外假设，不能据此宣称感知差距已被证明会导致特定行为。PDF 托管于第三方个人学术站点而非作者或机构库，来源归属已用出版社记录交叉核对，但长期可用性弱于机构仓储。"
  }
]
