[
  {
    "id": "Q347",
    "source_type": "primary_scholarship",
    "title": "Organizing and the Process of Sensemaking",
    "authors_or_organization": [
      "Karl E. Weick",
      "Kathleen M. Sutcliffe",
      "David Obstfeld"
    ],
    "year": 2005,
    "publisher_or_venue": "Organization Science, 16(4), 409–421",
    "doi": "10.1287/orsc.1050.0133",
    "url": "https://scispace.com/pdf/organizing-and-the-process-of-sensemaking-4qk2e6f9y9.pdf",
    "language": "en",
    "accessed_at": "2026-09-16",
    "access_status": "full_text",
    "bibliographic_note": "已实际打开并核读可访问的 13 页出版社排版全文，题名、作者、期刊卷期页码和 DOI 均与正式记录一致。正文印刷页 409–410 将 sensemaking 描述为持续、回顾性地形成可行解释：行动者在社会情境中从进行中的情境提取线索，以语言把组织情境形成可明确理解且可导向行动的 situation；同处说明意义在这里形成并影响、约束身份与行动。正文同时把显性的 sensemaking 限定在预期与现实不一致、行动路径不明显或经验流变得难以理解等中断情境，并强调行动、解释、语言与交流的联动；不能据此把任何一般性的理解、信息接收或个体认知都称为 sensemaking。"
  }
]
